{
  "id": "volkswagen-t-roc",
  "make": "Volkswagen",
  "model": "T-Roc",
  "generation": "First generation / 2021 update references",
  "modelYears": [
    "2017-2025"
  ],
  "bodyStyle": "compact SUV / crossover",
  "rentalClasses": [
    "compact SUV",
    "intermediate SUV",
    "crossover"
  ],
  "commonRentalAliases": [
    "Volkswagen T-Roc or similar",
    "VW T-Roc or similar",
    "Compact SUV"
  ],
  "cargoZones": [
    {
      "id": "boot_seats_up",
      "label": "Boot / trunk with rear seats up",
      "volumeLitres": 445,
      "dimensionsMm": {
        "length": 810,
        "width": 1010,
        "height": 544
      },
      "usableFraction": 0.82,
      "confidence": "low",
      "notes": "Manufacturer volume is sourced; rectangular dimensions are first-pass estimated cuboids for MVP packing and should be replaced by measured cargo dimensions.",
      "seatBackEncroachment": {
        "angleFromVerticalDegrees": 20,
        "notes": "Default rear seat-back rake assumption for optional encroachment-aware cargo planning."
      }
    },
    {
      "id": "boot_seats_folded",
      "label": "Expanded cargo area with rear seats folded",
      "volumeLitres": 1290,
      "dimensionsMm": {
        "length": 1450,
        "width": 1010,
        "height": 881
      },
      "usableFraction": 0.72,
      "confidence": "low",
      "notes": "Manufacturer folded volume is sourced where available; dimensions estimate a box-like load floor and ignore seat rake, wheel arches, and trim intrusions."
    },
    {
      "id": "rear_seat_footwell",
      "label": "Rear passenger footwell overflow",
      "volumeLitres": 80,
      "dimensionsMm": {
        "length": 650,
        "width": 1100,
        "height": 180
      },
      "usableFraction": 0.45,
      "confidence": "low",
      "notes": "Generic overflow area, enabled only when passenger space can be used."
    }
  ],
  "seatConfigurations": [
    {
      "id": "seats_up",
      "label": "Rear seats up",
      "cargoZoneIds": [
        "boot_seats_up"
      ],
      "seatsAvailable": 5
    },
    {
      "id": "rear_folded",
      "label": "Rear seats folded",
      "cargoZoneIds": [
        "boot_seats_up",
        "boot_seats_folded"
      ],
      "seatsAvailable": 2,
      "notes": "For two occupants plus cargo; exact split-fold support varies by trim."
    },
    {
      "id": "seats_up_with_footwell",
      "label": "Rear seats up with rear footwell overflow",
      "cargoZoneIds": [
        "boot_seats_up",
        "rear_seat_footwell"
      ],
      "seatsAvailable": 4,
      "notes": "Assumes at least one rear passenger position is sacrificed for soft bags."
    }
  ],
  "sources": [
    {
      "sourceType": "manufacturer",
      "publisher": "Volkswagen Spain",
      "title": "Medidas T-Roc, dimensiones y maletero",
      "url": "https://www.volkswagen.es/es/modelos/t-roc-runout/medidas.html",
      "retrievedAt": "2026-05-13",
      "fieldsCovered": [
        "boot volume",
        "folded boot volume",
        "vehicle dimensions"
      ],
      "confidence": "high"
    },
    {
      "sourceType": "rental-company",
      "publisher": "Hertz",
      "title": "Travel Agent Guide / European Fleet Guide",
      "url": "https://images.hertz.com/pdfs/TA_Guide_Online.pdf",
      "retrievedAt": "2026-05-13",
      "fieldsCovered": [
        "European rental fleet example models"
      ],
      "confidence": "medium"
    }
  ]
}
