{
  "id": "volkswagen-golf",
  "make": "Volkswagen",
  "model": "Golf",
  "generation": "Golf 8",
  "modelYears": [
    "2019-present"
  ],
  "bodyStyle": "5-door hatchback",
  "rentalClasses": [
    "compact",
    "compact elite",
    "small family hatchback"
  ],
  "commonRentalAliases": [
    "Volkswagen Golf or similar",
    "VW Golf or similar",
    "Compact automatic"
  ],
  "cargoZones": [
    {
      "id": "boot_seats_up",
      "label": "Boot / trunk with rear seats up",
      "volumeLitres": 380,
      "dimensionsMm": {
        "length": 750,
        "width": 1030,
        "height": 492
      },
      "usableFraction": 0.82,
      "confidence": "low",
      "notes": "Le volume constructeur est sourcé ; les dimensions rectangulaires sont des cuboïdes estimés en première approximation pour le MVP et doivent être remplacées par des mesures réelles du coffre.",
      "seatBackEncroachment": {
        "angleFromVerticalDegrees": 20,
        "notes": "Hypothèse par défaut de l’inclinaison du dossier arrière pour une planification du coffre tenant compte de l’empiètement."
      }
    },
    {
      "id": "boot_seats_folded",
      "label": "Expanded cargo area with rear seats folded",
      "volumeLitres": 1237,
      "dimensionsMm": {
        "length": 1450,
        "width": 1030,
        "height": 827
      },
      "usableFraction": 0.72,
      "confidence": "low",
      "notes": "Manufacturer folded volume is sourced where available; dimensions estimate a box-like load floor and ignore seat rake, wheel arches, and trim intrusions."
    },
    {
      "id": "rear_seat_footwell",
      "label": "Rear passenger footwell overflow",
      "volumeLitres": 80,
      "dimensionsMm": {
        "length": 650,
        "width": 1100,
        "height": 180
      },
      "usableFraction": 0.45,
      "confidence": "low",
      "notes": "Generic overflow area, enabled only when passenger space can be used."
    }
  ],
  "seatConfigurations": [
    {
      "id": "seats_up",
      "label": "Rear seats up",
      "cargoZoneIds": [
        "boot_seats_up"
      ],
      "seatsAvailable": 5
    },
    {
      "id": "rear_folded",
      "label": "Rear seats folded",
      "cargoZoneIds": [
        "boot_seats_up",
        "boot_seats_folded"
      ],
      "seatsAvailable": 2,
      "notes": "For two occupants plus cargo; exact split-fold support varies by trim."
    },
    {
      "id": "seats_up_with_footwell",
      "label": "Rear seats up with rear footwell overflow",
      "cargoZoneIds": [
        "boot_seats_up",
        "rear_seat_footwell"
      ],
      "seatsAvailable": 4,
      "notes": "Assumes at least one rear passenger position is sacrificed for soft bags."
    }
  ],
  "sources": [
    {
      "sourceType": "manufacturer",
      "publisher": "Volkswagen Newsroom",
      "title": "The technical data of the new Golf",
      "url": "https://www.volkswagen-newsroom.com/en/the-new-golf-international-vehicle-presentation-5609/the-technical-data-of-the-new-golf-5626",
      "retrievedAt": "2026-05-13",
      "fieldsCovered": [
        "luggage compartment volume",
        "vehicle dimensions"
      ],
      "confidence": "high"
    },
    {
      "sourceType": "rental-company",
      "publisher": "Hertz",
      "title": "Travel Agent Guide / European Fleet Guide",
      "url": "https://images.hertz.com/pdfs/TA_Guide_Online.pdf",
      "retrievedAt": "2026-05-13",
      "fieldsCovered": [
        "European rental fleet example models"
      ],
      "confidence": "medium"
    },
    {
      "sourceType": "rental-broker",
      "publisher": "Auto Europe",
      "title": "Avis car rental classes guide",
      "url": "https://www.autoeurope.com/avis-car-classes/",
      "retrievedAt": "2026-05-13",
      "fieldsCovered": [
        "rental fleet example models"
      ],
      "confidence": "medium"
    }
  ]
}
